Rating,Review
5 stars,"One stop solution for all orthopedic problems."
5 stars,"Best hospitals for orthopaedic issues, Visited for nerv block treatment for my mother, good experience with specialist doctors as well as cooperative staff...Thanks Team Sancheti "
1 star,"My father posted for an Ot today i.e.on 8/11/22 in the afternoon but when we reached here in the morning , they are saying sorry as private  rooms are not available...pathetic ...ot charges taken as per private room and they are offering us …  More"
5 stars,"Last 5 Year I am Suffering From Low Back pain  And Knee Pain Taking Medicine From Other Doctors But Still Pain Continue,
Ajay Kothari Dr help me and make it better and best part is only with exercises "
1 star,"Pathetic queue management have come at 10:am and still waiting till 1:20,there is no coordination,queues are skipped based on any known connection "
